{"$schema":"https://json-schema.org/draft/2020-12/schema","additionalProperties":false,"allOf":[{"if":{"properties":{"finalDecision":{"const":"APPROVE"}},"required":["finalDecision"]},"then":{"properties":{"affectedFields":{"maxItems":0},"finalSeverity":{"type":"null"},"materialIssues":{"maxItems":0}}}},{"if":{"properties":{"finalDecision":{"const":"REVISE"}},"required":["finalDecision"]},"then":{"properties":{"affectedFields":{"minItems":1},"finalSeverity":{"enum":["MINOR","SEVERE"]},"materialIssues":{"minItems":1}}}}],"description":"Authoritative final human adjudication record for Candidate Verifier v1.4 evaluation under VERIFIER_BLINDED_AI_ASSISTED_HUMAN_ADJUDICATION. Cryptographically binds Sophia Zhao's final ground truth to the exact blind review packet and the exact Gemini and Claude advisory records inspected before adjudication.","properties":{"adjudicationTimestamp":{"format":"date-time","type":"string"},"adjudicator":{"const":"Sophia Zhao","type":"string"},"affectedFields":{"items":{"enum":["description","whyWatch","curiosityHook","vibeSummary"],"type":"string"},"type":"array"},"agreementPattern":{"enum":["BOTH_AI_AGREE_WITH_HUMAN","GEMINI_ONLY_AGREES","CLAUDE_ONLY_AGREES","BOTH_AI_DISAGREE_WITH_HUMAN","AI_MODELS_DISAGREE_HUMAN_MATCHES_GEMINI","AI_MODELS_DISAGREE_HUMAN_MATCHES_CLAUDE","OTHER"],"type":"string"},"blindPacketHash":{"pattern":"^sha256:[a-f0-9]{64}$","type":"string"},"candidateId":{"pattern":"^(scale500|exp100)-tmdb-[0-9]+$","type":"string"},"claudeAdvisoryRecordSha256":{"pattern":"^sha256:[a-f0-9]{64}$","type":"string"},"finalDecision":{"enum":["APPROVE","REVISE"],"type":"string"},"finalSeverity":{"enum":["MINOR","SEVERE",null],"type":["string","null"]},"geminiAdvisoryRecordSha256":{"pattern":"^sha256:[a-f0-9]{64}$","type":"string"},"humanRationale":{"minLength":1,"type":"string"},"materialIssues":{"items":{"type":"string"},"type":"array"}},"required":["candidateId","blindPacketHash","geminiAdvisoryRecordSha256","claudeAdvisoryRecordSha256","adjudicator","finalDecision","finalSeverity","affectedFields","materialIssues","humanRationale","agreementPattern","adjudicationTimestamp"],"title":"HumanAdjudicationRecordV1","type":"object"}
