{"adjudicationTimestamp":"2026-09-19T08:53:41.852Z","adjudicator":"Sophia Zhao","affectedFields":[],"agreementPattern":"BOTH_AI_AGREE_WITH_HUMAN","blindPacketHash":"sha256:9970d91259c016e35b1551e2ba80cb606f1255120ceb51b13d1e3bb9921c264d","candidateId":"scale500-tmdb-15080","claudeAdvisoryRecordSha256":"sha256:1816658da8c371868495b2f984f130d2c97049c3e5f0da3d15fa7b940556b6ab","finalDecision":"APPROVE","finalSeverity":null,"geminiAdvisoryRecordSha256":"sha256:4b64d885abd441301aaf2d0f6e6bdf52f818bff73e643c2aab6b2a8d3d44d3c6","humanRationale":"thematic framing, not affect facts or real context","materialIssues":[]}
