{"adjudicationTimestamp":"2026-09-18T21:39:29.671Z","adjudicator":"Sophia Zhao","affectedFields":[],"agreementPattern":"BOTH_AI_AGREE_WITH_HUMAN","blindPacketHash":"sha256:82728c6521f1e0b81f4c369caf7f2a1d7fd3cdbc2b4ee248179fff51d30213c2","candidateId":"scale500-tmdb-18912","claudeAdvisoryRecordSha256":"sha256:251d69387e2d7e1bc0f9f7aa52668b74d15fecf56acc3be5df3ebe167d3b238b","finalDecision":"APPROVE","finalSeverity":null,"geminiAdvisoryRecordSha256":"sha256:2f1f0112285190f462f58c2a103fdb85f33bb05416205239dcafaa58db7d4575","humanRationale":"everything seems great","materialIssues":[]}
