{"adjudicationTimestamp":"2026-09-20T04:32:58.691Z","adjudicator":"Sophia Zhao","affectedFields":["curiosityHook","description"],"agreementPattern":"BOTH_AI_AGREE_WITH_HUMAN","blindPacketHash":"sha256:eb961cebea63d5d3639aac62282a070c06bf34e1e5b3bbc4be26cd617ed0f609","candidateId":"scale500-tmdb-377263","claudeAdvisoryRecordSha256":"sha256:4bfa3f96fb424154fc472a3646a95b8823e5ca1a83c31bd0f4f4736d1f3b5638","finalDecision":"REVISE","finalSeverity":"MINOR","geminiAdvisoryRecordSha256":"sha256:d362c15ecd4fc9052a2b0747582802f7cfe006055fbb4b1a398e9449b1c3c177","humanRationale":"A plausible inference still does not equate to an authorized assertion, particularly when it specifies identity, location, or relationship.","materialIssues":["“In post-World War I Germany” turns the protagonist’s German nationality into a specific story location that the authorized overview does not establish.","“French soldier” assigns military status to the mysterious French visitor even though the authorized source identifies him only as a “mysterious French man”; “soldier” appears only in non-authorized facts.keywords.","“fallen soldier's grave” similarly assigns military status to the deceased fiancé without authorization from the allowed source material.","“across national borders” asserts that the French visitor crossed an international border to reach the grave, although the authorized overview does not establish the grave’s location or such travel.","“What deep bond” presupposes a substantive relationship between the French visitor and the deceased fiancé, narrowing a connection that the authorized overview deliberately leaves mysterious."]}
