{"adjudicationTimestamp":"2026-09-18T00:26:01.647Z","adjudicator":"Sophia Zhao","affectedFields":[],"agreementPattern":"BOTH_AI_AGREE_WITH_HUMAN","blindPacketHash":"sha256:f13b5060f1ff26269ffa4d5d0c5eb1095b79e15e731282741a388551e04be986","candidateId":"exp100-tmdb-672647","claudeAdvisoryRecordSha256":"sha256:cc93770f3b50f7d3ebe2415cc82f677f258b31ec2d66c7b81cf053b8cee8c42d","finalDecision":"APPROVE","finalSeverity":null,"geminiAdvisoryRecordSha256":"sha256:7d60fd2301c432d974e3704ad99119ff29edd911094bd3ec1154b416790a0926","humanRationale":"no for 1-3. yes for 4, never crossing the line into an ungrounded factual assertion for 5","materialIssues":[]}
