{"adjudicationTimestamp":"2026-09-20T05:07:35.472Z","adjudicator":"Sophia Zhao","affectedFields":["curiosityHook","description","vibeSummary","whyWatch"],"agreementPattern":"AI_MODELS_DISAGREE_HUMAN_MATCHES_CLAUDE","blindPacketHash":"sha256:cb097d4836e9991162e8cd6cfb2d8e8b15d180b24321acbd2e4079ac76a6c58a","candidateId":"scale500-tmdb-2654","claudeAdvisoryRecordSha256":"sha256:ac9bbf7330aa46ca24700a29d0e8289ae4d83443cd1f3ad2d62f6b915c23d49e","finalDecision":"REVISE","finalSeverity":"MINOR","geminiAdvisoryRecordSha256":"sha256:12b9d9f8c88544fedf6f585635d95b414589c10364273ae298bf892345e77784","humanRationale":"genre and atmosphere may suggest something supernatural, but they do not authorize a specific fiction-reality mechanic.","materialIssues":["“the line between a bestselling horror writer's fiction and the physical world begins to blur,” “the author's books seems to be bleeding into reality,” “reality-warping horror,” and “reality-bending terror” resolve the authorized overview’s deliberately open statement that the books have an impact “far more than inspirational” into a specific fiction–reality crossover mechanic that the source does not establish, narrowing the central mystery and implying a later supernatural development."]}
