{"adjudicationTimestamp":"2026-09-19T08:50:13.005Z","adjudicator":"Sophia Zhao","affectedFields":["description"],"agreementPattern":"AI_MODELS_DISAGREE_HUMAN_MATCHES_CLAUDE","blindPacketHash":"sha256:3dd0abf6cd1622c5599da023f38e4fdf3d6a6fda00d72503b7c9054b3ed859ed","candidateId":"scale500-tmdb-254375","claudeAdvisoryRecordSha256":"sha256:99f75471c41529ad8b9f6bc70cc867bf8890573ed001c5349f7e552847b6cbcb","finalDecision":"REVISE","finalSeverity":"MINOR","geminiAdvisoryRecordSha256":"sha256:abd25586cba9e84b1dc5ac15e2e935b033feef4e158ed40a0986013c91797564","humanRationale":"an casual relationship should not be create without concrete evidence","materialIssues":["“leaves behind ... girlfriend Clara” introduces an unsupported relationship/departure implication; the authorized source establishes that Hector confides in Clara and then embarks on a global quest, but does not state that he leaves her behind or separates from her."]}
