{"adjudicationTimestamp":"2026-09-20T04:53:20.452Z","adjudicator":"Sophia Zhao","affectedFields":["curiosityHook","description","whyWatch"],"agreementPattern":"AI_MODELS_DISAGREE_HUMAN_MATCHES_CLAUDE","blindPacketHash":"sha256:d4d68144bbe4e6080932763639433360c646fd8c454424a92ca4f4e8fc5c59d9","candidateId":"scale500-tmdb-10800","claudeAdvisoryRecordSha256":"sha256:cc0b789050f579bf0ff1ca63196f50f60111ec5954d8b231e76e7ba2743cf7fd","finalDecision":"REVISE","finalSeverity":"MINOR","geminiAdvisoryRecordSha256":"sha256:3549088289527e6ccc2fa16ee94b616d644c906719a13acd7c01b763554a81af","humanRationale":"fantasy atmosphere can be inferred, but specific world physics cannot.","materialIssues":["“fractured sky,” “floating islands,” and “floating landscape” turn the authorized “vast conglomerate of islands of varying size and shape” into an aerial world of physically floating islands, adding an unsupported world-setting mechanic that materially changes the viewer’s visual expectation of the setting."]}
